{
  "request_id": "req-2026-05-02-001",
  "kind": "mission_seed",
  "skill": "vision-to-mission",
  "speed_hint": "fast",
  "project": "gsd-skill-creator",
  "branch": "dev",
  "provenance": {
    "source_findings": ["F-abc12345", "F-def67890"],
    "source_briefing": "B-2026050201",
    "ai_confidence": "medium",
    "ai_rank": 1,
    "ai_rationale": "Hot-spot in src/intelligence/analyzer/core.ts intersects with two coupling spikes; addressing it unblocks the live-work stream.",
    "developer_approved_at": "2026-05-02T20:14:32.000Z",
    "developer_modifications": [
      "tightened scope to single-file refactor",
      "added 'document the boundary' as a follow-on"
    ],
    "meeting_id": "M-2026-05-02-0001",
    "meeting_excerpt_url": ".planning/intelligence/meetings/M-2026-05-02-0001.md#decisions",
    "kb_snapshot": "v1.49.597+local"
  },
  "constraints": {
    "max_research_searches": 8,
    "crew_profile": "squadron",
    "output_format": "markdown-package"
  },
  "bundle_id": "M-2026-05-02-0001"
}
